{
    "$schema": "http://json-schema.org/draft-07/schema#",
    "required": [
        "shared_zones",
        "player_zones",
        "players",
        "decks"
    ],
    "properties": {
        "tricks": {
            "type": "boolean",
            "description": "whether the game is played in tricks"
        },
        "turns": {
            "type": "boolean",
            "description": "whether the game is player in turns"
        },
        "shared_zones": {
            "type": "array",
            "description": "an enumeration of any global card zones: each of these zones is created only the specified number of times, and are not duplicated depending on the player count",
            "items": {
                "$ref": "./zone_descriptor.schema.json"
            }
        },
        "player_zones": {
            "type": "array",
            "description": "an enumaration of player-specific zones: a copy of each of these zones is create for each player in the game",
            "items": {
                "$ref": "./zone_descriptor.schema.json"
            }
        },
        "decks": {
            "type": "array",
            "description": "an enumeration and labelling of the decks which will be used in the game",
            "items": {
                "type": "object",
                "required": [
                    "name",
                    "source"
                ],
                "properties": {
                    "name": {
                        "type": "string",
                        "description": "the name which is used within this object to refer to this deck"
                    },
                    "source": {
                        "type": "string",
                        "description": "path to a source deck file"
                    },
                    "each_player": {
                        "type": "boolean",
                        "description": "whether a copy of this deck should be created for each player in the game"
                    },
                    "aces_high": {
                        "type": "boolean",
                        "description": "in games where card values can be assigned and well ordered, should aces/ones be considered high or low"
                    }
                }
            }
        },
        "players": {
            "allOf": [{ "$ref": "./count.schema.json" }],
            "description": "the number of players that the game accomodates"
        }
    }
}